{
  "identifier": "second-wave",
  "displayName": "Second Wave",
  "version": "0.14.5",
  "author": "Anonemous2, billthebluebot, Taiga, Quitch, Quildtide, Ferretmaster, Tatarstan, DrWondertainment",
  "description": "Expansion mod adding new units to MLA, Legion, and Bugs factions",
  "dateCreated": "2025-08-07",
  "build": "124616",
  "type": "mod",
  "mods": [
    "pa.mla.unit.addon",
    "pa.mla.unit.addon.companion"
  ],
  "isBalanceMod": true,
  "baseFactions": [
    "Bugs",
    "Legion",
    "MLA"
  ]
}