{
  "identifier": "legion",
  "displayName": "Legion",
  "version": "1.0.0",
  "author": "Legion Expansion Team",
  "description": "The Legion faction - adds a second fully playable faction with unique units",
  "type": "mod",
  "mods": [
    "com.pa.legion-expansion-server",
    "com.pa.legion-expansion-client"
  ],
  "backgroundImage": "assets/ui/mods/com.pa.legion-expansion/img/splash_no_logo.png"
}