{
  "identifier": "testfaction",
  "displayName": "Test Faction",
  "version": "1.0.0",
  "author": "Test Mod Author",
  "description": "A test mod faction for E2E testing",
  "type": "mod",
  "build": "100000",
  "mods": [
    "com.test.faction-mod",
    "github.com/test-org/test-faction/tree/main/src/server",
    "github.com/test-org/test-faction/tree/main/src/client"
  ]
}